{
  "$schema": "http://json-schema.org/draft-07/schema#",
  "$id": "track-presentation.schema.json",
  "type": "object",
  "required": ["schema_version", "track_id", "track_version", "default_locale", "locales"],
  "properties": {
    "schema_version": { "const": 1 },
    "track_id": { "type": "string", "pattern": "^[a-z0-9]+(?:-[a-z0-9]+)*$" },
    "track_version": { "type": "string", "minLength": 1 },
    "default_locale": { "type": "string", "minLength": 2 },
    "locales": {
      "type": "object",
      "minProperties": 1,
      "additionalProperties": {
        "type": "object",
        "required": ["display_name", "brand", "hero", "domain_labels"],
        "properties": {
          "display_name": { "type": "string", "minLength": 1 },
          "brand": { "type": "string", "minLength": 1 },
          "hero": {
            "type": "object",
            "required": ["eyebrow", "title", "description"],
            "properties": {
              "eyebrow": { "type": "string", "minLength": 1 },
              "title": { "type": "string", "minLength": 1 },
              "description": { "type": "string", "minLength": 1 }
            },
            "additionalProperties": false
          },
          "domain_labels": {
            "type": "object",
            "minProperties": 1,
            "additionalProperties": { "type": "string", "minLength": 1 }
          }
        },
        "additionalProperties": false
      }
    }
  },
  "additionalProperties": false
}
