{
  "schema_version": 1,
  "track_id": "example-track",
  "track_version": "1",
  "default_locale": "en",
  "locales": {
    "en": {
      "display_name": "Example Track",
      "brand": "Example Track",
      "hero": {
        "eyebrow": "Fixture",
        "title": "Example",
        "description": "Test-only track."
      },
      "domain_labels": {
        "Example": "Example"
      }
    }
  }
}
