{
  "schema_version": 1,
  "track_id": "sdaia-ai-engineer",
  "track_version": "2026.09",
  "default_locale": "ar",
  "locales": {
    "ar": {
      "display_name": "SDAIA AI Engineer",
      "brand": "SDAIA AI Engineer · بنك الاختبارات",
      "hero": {
        "eyebrow": "بنك اختبارات ثنائي اللغة",
        "title": "تدرّب مثل الاختبار، بدون نمط محفوظ للإجابات.",
        "description": "أكثر من ألف سؤال بالعربي والإنجليزي، اختبار كامل موزون، واختبارات مستقلة لكل مجال."
      },
      "domain_labels": {
        "mlops-llmops": "عمليات تعلم الآلة والنماذج اللغوية",
        "data-ml": "البيانات وتعلم الآلة والتقييم",
        "core-ai": "أساسيات الذكاء الاصطناعي والتعلم العميق والذكاء التوليدي",
        "responsible-ai-security-governance": "الذكاء المسؤول والأمن والحوكمة",
        "ai-software-engineering": "هندسة برمجيات الذكاء الاصطناعي",
        "architecture-infrastructure": "المعمارية والبنية التحتية",
        "business-professional-practice": "الأعمال والممارسة المهنية"
      }
    },
    "en": {
      "display_name": "SDAIA AI Engineer",
      "brand": "SDAIA AI Engineer · Exam Bank",
      "hero": {
        "eyebrow": "Bilingual exam bank",
        "title": "Practice like an exam, without a predictable answer pattern.",
        "description": "More than one thousand Arabic/English questions, a weighted full exam, and standalone domain exams."
      },
      "domain_labels": {
        "mlops-llmops": "MLOps / LLMOps",
        "data-ml": "Data / ML / Evaluation",
        "core-ai": "Core AI / Deep Learning / GenAI",
        "responsible-ai-security-governance": "Responsible AI / Security / Governance",
        "ai-software-engineering": "AI Software Engineering",
        "architecture-infrastructure": "Architecture / Infrastructure",
        "business-professional-practice": "Business / Professional Practice"
      }
    }
  }
}
